{
  "schema_version": "item-description-final-decisions.v1",
  "session": "令和8年第4回定例会",
  "diet_session_slug": "ishigaki-r8-dai4-teireikai",
  "artifact_type": "item_description_final_decisions",
  "artifact_origin": "hand_authored_reviewer_decision",
  "review_status": "reviewer_only",
  "batch": {
    "batch_id": "item_descriptions_batch_3",
    "reviewed_at": "2026-07-24",
    "reviewed_from_commit": "4bab09bdf0f097dca67b84462091eb1db34c711b"
  },
  "sources": {
    "candidate_inventory": "docs/general_questions_minutes/item-description-candidates/r8-dai4-teireikai.item-description-candidates.json",
    "utterance_index": "docs/general_questions_minutes/utterance-index/r8-dai4-teireikai.utterances.json",
    "public_general_questions_json": "docs/general_questions/r8-dai4-teireikai.general-questions.json",
    "canonical_minutes": "docs/general_questions_minutes/r8-dai4-teireikai.canonical.json",
    "review_packet": "Codex Batch 3 item-description content review on 2026-07-24"
  },
  "summary": {
    "target_item_total": 22,
    "approve_as_written_total": 0,
    "approve_with_revision_total": 16,
    "hold_total": 6,
    "reject_total": 0,
    "approved_normal_total": 16,
    "approved_detailed_total": 16,
    "public_json_changed": false,
    "production_import_executed": false,
    "revalidation_executed": false
  },
  "official_wording_audits": [
    {
      "topic": "東内原とも子 item05 登山道整備の山名表記",
      "source_wording": [
        "utterance index questioner text: 尾本岳登山道整備",
        "utterance index executive text: おもとだけ登山道整備",
        "canonical minutes include mixed OCR/transcription variants: 尾本岳, おもとだけ, 元だけ, お元だけ"
      ],
      "public_json_title": "登山道整備の進捗状況について",
      "candidate_artifact_wording": "登山道整備の進捗状況について",
      "approved_description_wording": "登山道整備",
      "finding": "Repository sources support the reading おもとだけ, but do not provide a stable in-repository kanji form for 於茂登岳. The approved public candidate avoids the unconfirmed mountain name.",
      "public_json_title_fix_needed": false,
      "separate_follow_up": "If a later source-normalization pass confirms the official kanji, update source artifacts and any public wording in a separate PR."
    }
  ],
  "decisions": [
    {
      "decision_id": "item-descriptions-batch-3::higashiuchihara-tomoko.item01",
      "questioner": "東内原とも子",
      "question_id": "ishigaki-r8-dai4-ippan-higashiuchihara-tomoko",
      "item_id": "item01",
      "item_number": 1,
      "item_title": "不登校児童生徒への支援体制について",
      "candidate_recommendation": "review_ready",
      "decision": "approve_with_revision",
      "approved_normal_description": "不登校児童生徒への校内外の支援体制を確認しています。",
      "approved_detailed_description": "校内教育支援センターのパイロット校での成果や設置状況を踏まえ、不登校児童生徒が学校内外でどのような支援を受けられるのかを確認しています。",
      "source_utterance_ids": [
        "ishigaki-r8-dai4-teireikai.gq.ishigaki-r8-dai4-ippan-higashiuchihara-tomoko.u0002"
      ],
      "source_support": {
        "status": "supported",
        "evidence_summary": "質問者が不登校児童生徒への支援体制、校内教育支援センターパイロット校の成果、設置状況を質問している。"
      },
      "revision_notes": [
        "Generated wording was shortened and made less like a sub-item list.",
        "Public wording does not include city answer results."
      ],
      "official_wording_check": {
        "status": "verified_from_public_json_and_source",
        "notes": "校内教育支援センター is stable in public JSON and source."
      },
      "ocr_risk": {
        "status": "low",
        "notes": "Source has パイロット校 OCR noise, but approved wording avoids the noisy fragment."
      },
      "answer_content_check": {
        "mixed": false,
        "notes": "No executive answer result is included."
      },
      "unsupported_inference_check": {
        "unsupported": false,
        "notes": "All elements are supported by the questioner utterance."
      },
      "recovery_requirements": null
    },
    {
      "decision_id": "item-descriptions-batch-3::higashiuchihara-tomoko.item02",
      "questioner": "東内原とも子",
      "question_id": "ishigaki-r8-dai4-ippan-higashiuchihara-tomoko",
      "item_id": "item02",
      "item_number": 2,
      "item_title": "幼児の弱視早期発見について",
      "candidate_recommendation": "review_ready",
      "decision": "approve_with_revision",
      "approved_normal_description": "幼児の弱視を早期に見つける検査と支援を確認しています。",
      "approved_detailed_description": "幼児期の弱視について、検査の実施状況と、早期発見・早期治療につなげるための取組を確認しています。",
      "source_utterance_ids": [
        "ishigaki-r8-dai4-teireikai.gq.ishigaki-r8-dai4-ippan-higashiuchihara-tomoko.u0003"
      ],
      "source_support": {
        "status": "supported",
        "evidence_summary": "質問者が幼児の弱視早期発見、実施状況、早期発見・早期治療に向けた取組を質問している。"
      },
      "revision_notes": [
        "Removed generic city-response framing.",
        "Kept wording limited to the questioner's listed issues."
      ],
      "official_wording_check": {
        "status": "verified_from_public_json_and_source",
        "notes": "弱視, 早期発見, 早期治療 are stable."
      },
      "ocr_risk": {
        "status": "low",
        "notes": "No material OCR risk in approved wording."
      },
      "answer_content_check": {
        "mixed": false,
        "notes": "No city answer content is included."
      },
      "unsupported_inference_check": {
        "unsupported": false,
        "notes": "All elements are supported by source."
      },
      "recovery_requirements": null
    },
    {
      "decision_id": "item-descriptions-batch-3::higashiuchihara-tomoko.item03",
      "questioner": "東内原とも子",
      "question_id": "ishigaki-r8-dai4-ippan-higashiuchihara-tomoko",
      "item_id": "item03",
      "item_number": 3,
      "item_title": "保育施設のICT導入による業務効率化について",
      "candidate_recommendation": "review_ready",
      "decision": "approve_with_revision",
      "approved_normal_description": "保育施設でのICT導入と保育士の負担軽減を確認しています。",
      "approved_detailed_description": "保育施設でのICT導入について、導入の進捗、保育士の業務負担軽減、今後の取組を確認しています。",
      "source_utterance_ids": [
        "ishigaki-r8-dai4-teireikai.gq.ishigaki-r8-dai4-ippan-higashiuchihara-tomoko.u0004"
      ],
      "source_support": {
        "status": "supported",
        "evidence_summary": "質問者が保育施設ICT導入の進捗、保育士の業務負担軽減、今後の取組を質問している。"
      },
      "revision_notes": [
        "Confirmed fact about 大川保育所 is not repeated.",
        "Detailed wording is question-scope only."
      ],
      "official_wording_check": {
        "status": "verified_from_public_json_and_source",
        "notes": "ICT, 保育施設, 保育士 are stable."
      },
      "ocr_risk": {
        "status": "low",
        "notes": "No material OCR risk in approved wording."
      },
      "answer_content_check": {
        "mixed": false,
        "notes": "The existing confirmed fact is not included."
      },
      "unsupported_inference_check": {
        "unsupported": false,
        "notes": "All elements are supported by questioner text."
      },
      "recovery_requirements": null
    },
    {
      "decision_id": "item-descriptions-batch-3::higashiuchihara-tomoko.item04",
      "questioner": "東内原とも子",
      "question_id": "ishigaki-r8-dai4-ippan-higashiuchihara-tomoko",
      "item_id": "item04",
      "item_number": 4,
      "item_title": "畜産農家の衛生環境の改善と母牛改良への支援策について",
      "candidate_recommendation": "review_ready",
      "decision": "approve_with_revision",
      "approved_normal_description": "畜産農家の衛生環境改善と母牛改良支援を確認しています。",
      "approved_detailed_description": "堆肥処理や運搬体制、害虫対策、家畜焼却炉、受精卵移植への補助などを取り上げ、畜産農家の衛生環境改善と母牛改良支援のあり方を確認しています。",
      "source_utterance_ids": [
        "ishigaki-r8-dai4-teireikai.gq.ishigaki-r8-dai4-ippan-higashiuchihara-tomoko.u0005"
      ],
      "source_support": {
        "status": "supported_with_ocr_normalization",
        "evidence_summary": "質問者が畜産農家の衛生環境、堆肥処理・運搬体制、害虫対策、家畜焼却炉、母牛改良、受精卵移植補助を質問している。"
      },
      "revision_notes": [
        "OCR-noisy phrases were normalized to public JSON/sub-item wording.",
        "No executive answer result or future city commitment is included."
      ],
      "official_wording_check": {
        "status": "verified_from_public_json_and_sub_items",
        "notes": "母牛改良, 堆肥処理, 家畜焼却炉, 受精卵移植 are taken from public JSON/sub_items."
      },
      "ocr_risk": {
        "status": "medium",
        "notes": "Source contains OCR noise such as 補給改良, 大変処理, 大秘, 家畜消化工業. Approved wording uses stable public JSON wording."
      },
      "answer_content_check": {
        "mixed": false,
        "notes": "City answer outcomes are excluded."
      },
      "unsupported_inference_check": {
        "unsupported": false,
        "notes": "All public wording elements are supported by public JSON and questioner utterance."
      },
      "recovery_requirements": null
    },
    {
      "decision_id": "item-descriptions-batch-3::higashiuchihara-tomoko.item05",
      "questioner": "東内原とも子",
      "question_id": "ishigaki-r8-dai4-ippan-higashiuchihara-tomoko",
      "item_id": "item05",
      "item_number": 5,
      "item_title": "登山道整備の進捗状況について",
      "candidate_recommendation": "review_ready",
      "decision": "approve_with_revision",
      "approved_normal_description": "登山道整備の進み具合を確認しています。",
      "approved_detailed_description": "登山道について、整備がどこまで進んでいるのかを確認しています。",
      "source_utterance_ids": [
        "ishigaki-r8-dai4-teireikai.gq.ishigaki-r8-dai4-ippan-higashiuchihara-tomoko.u0006"
      ],
      "source_support": {
        "status": "supported_with_official_wording_caveat",
        "evidence_summary": "質問者が登山道整備の進捗状況を質問している。山名の漢字表記はrepository内原資料だけでは確定しない。"
      },
      "revision_notes": [
        "Avoided the unconfirmed mountain-name kanji in public candidate fields.",
        "Generated/review wording that used 尾本岳 was not carried into approved public fields."
      ],
      "official_wording_check": {
        "status": "proper_noun_avoided",
        "notes": "Public JSON title is 登山道整備の進捗状況について. Source artifacts contain 尾本岳, おもとだけ, 元だけ, お元だけ. No stable in-repository kanji form for 於茂登岳 was found."
      },
      "ocr_risk": {